10:20:00.000020 IP 244.131.189.196.22379 > 245.184.172.199.80: tcp 0
10:20:00.000028 IP 0.121.193.213.80 > 4.107.103.69.2020: tcp 1460
10:20:00.000033 IP 0.3.117.36.80 > 100.140.88.183.40732: tcp 0
10:20:00.000033 IP 140.137.3.103.5662 > 237.118.29.232.1409: tcp 0
10:20:00.000033 IP 3.193.118.54.1657 > 236.230.104.55.6699: tcp 537
10:20:00.000048 IP 227.64.161.155.80 > 237.83.213.217.2440: tcp 0
10:20:00.000050 IP 3.3.239.91.11092 > 3.112.98.34.24886: tcp 1448
10:20:00.000055 IP 140.136.248.230.3617 > 3.82.176.112.21: tcp 0
10:20:00.000058 IP 0.180.247.23.4335 > 237.221.28.44.6699: tcp 536
10:20:00.000065 IP 227.139.51.168.80 > 115.155.159.194.2568: tcp 1460
10:20:00.000071 IP 162.131.189.129.8080 > 69.76.153.218.2146: tcp 1460
10:20:00.000076 IP 241.8.193.235.1753 > 237.57.188.54.4662: tcp 0
10:20:00.000087 IP 238.255.77.244.80 > 4.20.45.29.3291: tcp 1417
10:20:00.000098 IP 3.3.122.72.2653 > 4.18.167.118.6346: tcp 148
10:20:00.000121 IP 0.3.117.73.80 > 160.45.50.67.52627: tcp 1448
10:20:00.000126 IP 140.136.248.89.8015 > 3.82.176.112.21: tcp 0
10:20:00.000126 IP 140.136.248.222.26909 > 3.82.176.112.21: tcp 0
10:20:00.000126 IP 162.131.129.253.2429 > 69.141.77.199.2605: tcp 0
10:20:00.000127 IP 162.131.193.161.55811 > 252.176.127.225.53: UDP, length 35
10:20:00.000128 IP 241.46.188.127.80 > 237.178.242.28.2821: tcp 258
10:20:00.000129 IP 115.40.13.20.3260 > 225.113.10.118.3006: tcp 0
10:20:00.000130 IP 162.131.66.6.44758 > 242.67.96.26.80: tcp 0
10:20:00.000134 IP 140.136.248.112.16565 > 3.82.176.112.21: tcp 0
10:20:00.000139 IP 140.136.248.171.24417 > 3.82.176.112.21: tcp 0
10:20:00.000141 IP 162.133.105.227.3128 > 69.242.28.241.1803: tcp 1247
10:20:00.000145 IP 0.3.117.73.80 > 160.45.50.67.52627: tcp 72
10:20:00.000146 IP 115.43.115.251.4667 > 69.102.0.250.1214: tcp 0
10:20:00.000153 IP 238.255.72.251.80 > 4.27.60.190.1290: tcp 0
10:20:00.000168 IP 0.3.117.189.12903 > 71.140.40.103.80: tcp 0
10:20:00.000172 IP 0.121.193.213.80 > 4.107.103.69.2020: tcp 1460
10:20:00.000177 IP 0.3.117.73.80 > 160.45.50.67.52627: tcp 1448
10:20:00.000182 IP 140.136.248.68.11953 > 3.82.176.112.21: tcp 0
10:20:00.000189 IP 3.3.22.112.1384 > 237.191.245.251.1718: UDP, length 1280
10:20:00.000194 IP 140.136.22.186.2521 > 69.154.211.103.21: tcp 0
10:20:00.000194 IP 162.133.105.227.3128 > 69.242.28.241.1803: tcp 0
10:20:00.000215 IP 238.255.74.10.80 > 242.15.112.205.61554: tcp 0
10:20:00.000233 IP 241.201.119.10.80 > 69.27.20.17.3843: tcp 297
10:20:00.000237 IP 241.46.212.15.80 > 236.227.183.229.26308: tcp 485
10:20:00.000243 IP 115.42.247.74.52923 > 225.113.9.235.80: tcp 0
10:20:00.000250 IP 249.165.77.251.13130 > 227.247.173.89.59075: tcp 442
10:20:00.000260 IP 0.121.193.213.80 > 4.107.103.69.2020: tcp 1460
10:20:00.000265 IP 241.46.188.127.80 > 237.83.213.213.55408: tcp 255
10:20:00.000266 IP 0.3.117.184.80 > 0.166.128.11.19439: tcp 681
10:20:00.000281 IP 140.136.80.97.43869 > 3.82.176.112.21: tcp 0
10:20:00.000287 IP 140.136.248.92.58689 > 3.82.176.112.21: tcp 0
10:20:00.000307 IP 115.12.180.221.3989 > 245.103.33.243.6667: tcp 0
10:20:00.000322 IP 227.144.224.98.80 > 4.102.182.205.1453: tcp 232
10:20:00.000323 IP 3.176.43.8.1214 > 4.82.96.139.3843: tcp 536
10:20:00.000326 IP 241.46.188.127.80 > 237.251.236.93.1764: tcp 0
10:20:00.000338 IP 227.144.224.98.80 > 4.102.182.205.1453: tcp 1448
10:20:00.000357 IP 3.236.221.177.80 > 236.152.237.99.1382: tcp 536
10:20:00.000367 IP 162.131.66.6.44758 > 242.67.96.26.80: tcp 0
10:20:00.000368 IP 3.248.179.245.80 > 3.72.49.26.1686: tcp 785
10:20:00.000375 IP 140.136.248.28.54050 > 3.82.176.112.21: tcp 0
10:20:00.000380 IP 140.136.248.120.3335 > 3.82.176.112.21: tcp 0
10:20:00.000390 IP 0.3.117.37.80 > 100.140.88.183.40733: tcp 0
10:20:00.000405 IP 3.236.221.177.80 > 236.152.237.99.1382: tcp 536
10:20:00.000409 IP 225.213.25.234.1234 > 3.43.183.141.80: tcp 0
10:20:00.000409 IP 241.8.241.178.1234 > 69.242.28.30.6699: tcp 347
10:20:00.000411 IP 140.136.248.16.2732 > 3.82.176.112.21: tcp 0
10:20:00.000413 IP 140.115.207.14.23 > 1.15.206.72.1285: tcp 0
10:20:00.000422 IP 143.69.30.171.6699 > 69.100.152.37.4888: tcp 1460
10:20:00.000444 IP 3.236.223.25.80 > 4.26.122.116.1550: tcp 1460
10:20:00.000463 IP 238.109.212.234.4595 > 0.157.132.109.25: tcp 536
10:20:00.000465 IP 3.236.221.177.80 > 236.162.113.229.1232: tcp 536
10:20:00.000485 IP 140.136.248.20.17936 > 3.82.176.112.21: tcp 0
10:20:00.000485 IP 3.3.122.72.2653 > 4.18.167.118.6346: tcp 82
10:20:00.000505 IP 3.3.122.72.2653 > 4.18.167.118.6346: tcp 1460
10:20:00.000511 IP 242.46.71.35.1992 > 115.77.40.146.1214: tcp 57
10:20:00.000534 IP 3.248.85.239.8000 > 252.33.226.146.49154: tcp 543
10:20:00.000536 IP 115.19.239.99.30382 > 237.177.184.189.58228: UDP, length 337
10:20:00.000539 IP 3.3.122.105.1902 > 171.233.191.62.1300: tcp 758
10:20:00.000541 IP 238.109.212.234.4595 > 0.157.132.109.25: tcp 536
10:20:00.000544 IP 3.236.223.25.80 > 4.26.122.116.1550: tcp 1460
10:20:00.000549 IP 140.136.80.42.1084 > 3.82.176.112.21: tcp 0
10:20:00.000550 IP 140.136.80.178.59508 > 3.82.176.112.21: tcp 0
10:20:00.000556 IP 140.136.248.190.45121 > 3.82.176.112.21: tcp 0
10:20:00.000578 IP 239.248.83.11.80 > 0.60.77.188.20893: tcp 1448
10:20:00.000584 IP 3.3.119.208.554 > 129.19.154.217.1190: tcp 665
10:20:00.000587 IP 3.236.223.75.80 > 236.134.149.142.2403: tcp 536
10:20:00.000589 IP 3.248.179.245.1755 > 3.12.235.84.41557: tcp 781
10:20:00.000592 IP 0.3.117.181.80 > 162.130.21.255.4074: tcp 1380
10:20:00.000596 IP 0.15.129.38.1136 > 238.154.99.36.80: tcp 0
10:20:00.000596 IP 143.173.39.73.6112 > 237.38.92.101.6112: UDP, length 23
10:20:00.000597 IP 227.78.206.101.1217 > 227.231.61.92.80: tcp 368
10:20:00.000608 IP 143.173.6.77.3050 > 225.119.125.93.4662: tcp 1414
10:20:00.000613 IP 3.3.115.141.80 > 69.199.11.58.1738: tcp 841
10:20:00.000623 IP 140.136.80.16.37134 > 3.82.176.112.21: tcp 0
10:20:00.000632 IP 3.3.122.72.2653 > 4.18.167.118.6346: tcp 77
10:20:00.000633 IP 3.236.223.39.80 > 247.203.85.250.12565: tcp 0
10:20:00.000633 IP 3.248.96.164.4216 > 4.20.191.104.6346: tcp 0
10:20:00.000633 IP 3.248.96.164.4207 > 247.214.44.20.13071: tcp 0
10:20:00.000637 IP 140.136.248.39.32380 > 3.82.176.112.21: tcp 0
10:20:00.000645 IP 3.236.223.75.80 > 236.134.149.142.2403: tcp 536
10:20:00.000649 IP 3.3.122.72.2653 > 4.18.167.118.6346: tcp 1460
10:20:00.000654 IP 140.136.248.233.1102 > 3.82.176.112.21: tcp 0
10:20:00.000654 IP 225.209.31.220.3197 > 3.43.183.142.80: tcp 0
10:20:00.000674 IP 143.182.136.80.2116 > 237.55.93.179.4662: tcp 111
10:20:00.000685 IP 227.64.161.155.80 > 237.83.213.217.2440: tcp 0
10:20:00.000686 IP 227.64.161.155.80 > 237.83.213.217.2440: tcp 0
10:20:00.000707 IP 161.187.125.3.64989 > 227.117.187.187.80: tcp 0
10:20:00.000710 IP 0.3.117.181.80 > 162.130.21.255.4074: tcp 1380
10:20:00.000722 IP 0.3.117.189.12903 > 71.140.40.103.80: tcp 0
10:20:00.000731 IP 0.3.117.47.80 > 0.95.209.139.1296: tcp 0
10:20:00.000733 IP 3.248.121.134.1188 > 0.112.29.161.6346: tcp 0
10:20:00.000741 IP 3.248.121.134.1188 > 0.112.29.161.6346: tcp 508
10:20:00.000743 IP 0.3.117.184.80 > 227.65.121.105.1802: tcp 536
10:20:00.000756 IP 238.109.212.180.80 > 129.189.248.83.3044: tcp 1380
10:20:00.000763 IP 225.209.252.163.2956 > 3.43.183.139.80: tcp 0
10:20:00.000765 IP 241.46.185.227.80 > 237.84.150.2.1039: tcp 242
10:20:00.000774 IP 0.15.127.131.4662 > 115.74.37.169.4723: tcp 0
10:20:00.000778 IP 241.46.170.244.2460 > 237.251.235.85.1315: UDP, length 1380
10:20:00.000806 IP 0.15.220.78.443 > 69.31.32.71.1431: tcp 180
10:20:00.000807 IP 161.187.16.248.4662 > 237.184.78.221.1942: tcp 0
10:20:00.000830 IP 143.173.62.200.1419 > 236.143.19.89.6699: tcp 482
10:20:00.000838 IP 249.25.135.5.13130 > 0.3.221.168.49868: tcp 185
10:20:00.000840 IP 3.236.215.224.1065 > 236.63.159.251.53: UDP, length 44
10:20:00.000840 IP 227.64.161.155.80 > 237.83.213.217.2440: tcp 0
10:20:00.000840 IP 107.210.26.38.2479 > 115.72.30.201.6346: tcp 0
10:20:00.000843 IP 227.64.161.155.80 > 237.83.213.217.2440: tcp 0
10:20:00.000854 IP 3.248.179.245.1755 > 1.5.166.134.37007: tcp 781
10:20:00.000873 IP 238.109.212.180.80 > 129.189.248.83.3044: tcp 1380
10:20:00.000886 IP 241.46.235.117.80 > 224.223.170.114.2468: tcp 1460
10:20:00.000895 IP 3.3.115.141.80 > 69.199.11.58.1738: tcp 841
10:20:00.000900 IP 0.3.117.181.80 > 236.206.55.33.3019: tcp 1460
10:20:00.000911 IP 244.131.189.196.22379 > 245.184.172.199.80: tcp 0
10:20:00.000937 IP 3.236.223.84.80 > 4.44.30.77.2852: tcp 1460
10:20:00.000942 IP 115.52.53.197.6112 > 69.110.224.3.6112: UDP, length 26
10:20:00.000951 IP 238.109.212.178.80 > 3.86.216.32.1879: tcp 0
10:20:00.000972 IP 3.3.236.253.80 > 4.44.6.42.4358: tcp 1460
10:20:00.000977 IP 140.136.248.246.62481 > 3.82.176.112.21: tcp 0
10:20:00.000991 IP 238.109.212.178.80 > 236.30.76.179.27540: tcp 1380
10:20:00.000995 IP 3.3.115.141.80 > 69.199.11.58.1738: tcp 841
10:20:00.000998 IP 140.141.204.3.80 > 69.148.198.61.14294: tcp 1460
10:20:00.001006 IP 241.84.149.180.80 > 237.81.250.216.46871: tcp 0
10:20:00.001010 IP 241.46.218.114.80 > 237.87.59.75.2642: tcp 273
10:20:00.001024 IP 241.46.235.117.80 > 224.223.170.114.2468: tcp 1460
10:20:00.001048 IP 3.193.125.207.1214 > 4.87.238.44.2264: tcp 1460
10:20:00.001061 IP 140.136.248.163.44663 > 3.82.176.112.21: tcp 0
10:20:00.001061 IP 140.136.80.111.20721 > 3.82.176.112.21: tcp 0
10:20:00.001062 IP 140.136.248.124.4829 > 3.82.176.112.21: tcp 0
10:20:00.001062 IP 140.136.80.138.30056 > 3.82.176.112.21: tcp 0
10:20:00.001063 IP 162.131.175.235.43762 > 237.166.176.27.80: tcp 0
10:20:00.001068 IP 140.136.248.92.12063 > 3.82.176.112.21: tcp 0
10:20:00.001072 IP 227.64.161.155.80 > 237.83.213.217.2440: tcp 0
10:20:00.001080 IP 162.131.189.129.80 > 69.4.145.139.3618: tcp 1460
10:20:00.001085 IP 241.46.235.117.80 > 225.113.70.165.1461: tcp 1422
10:20:00.001090 IP 3.236.223.84.80 > 4.44.30.77.2852: tcp 1460
10:20:00.001102 IP 115.42.247.76.9162 > 0.3.207.230.80: tcp 0
10:20:00.001113 IP 238.109.212.178.80 > 236.30.76.179.27540: tcp 1380
10:20:00.001118 IP 3.236.223.75.80 > 244.134.5.136.23812: tcp 1448
10:20:00.001123 IP 140.112.32.213.39373 > 252.80.191.254.53: tcp 0
10:20:00.001125 IP 241.46.139.14.25 > 237.40.232.37.61135: tcp 0
10:20:00.001127 IP 3.3.236.253.80 > 4.44.6.42.4358: tcp 1460
10:20:00.001132 IP 241.46.139.14.25 > 237.40.232.37.61135: tcp 69
10:20:00.001138 IP 241.46.235.117.80 > 224.223.170.114.2468: tcp 1460
10:20:00.001143 IP 3.216.25.224.43506 > 238.57.83.150.25: tcp 1380
10:20:00.001148 IP 3.223.149.14.80 > 236.175.140.198.1859: tcp 536
10:20:00.001150 IP 238.93.38.5.49204 > 227.231.105.253.80: tcp 0
10:20:00.001157 IP 3.3.241.156.8452 > 4.29.86.119.4376: tcp 1460
10:20:00.001162 IP 237.69.28.231.1436 > 3.43.183.142.80: tcp 0
10:20:00.001162 IP 227.9.219.116.80 > 69.91.255.217.1610: tcp 1460
10:20:00.001174 IP 245.24.172.109.1444 > 238.223.138.247.80: tcp 306
10:20:00.001190 IP 0.3.117.180.80 > 100.141.178.144.3094: tcp 1380
10:20:00.001197 IP 241.46.235.117.80 > 225.113.70.165.1461: tcp 415
10:20:00.001198 IP 244.53.87.59.2448 > 227.247.121.2.443: tcp 0
10:20:00.001202 IP 245.24.172.109.1443 > 238.223.138.247.80: tcp 0
10:20:00.001208 IP 241.46.235.117.80 > 225.113.70.165.1461: tcp 1422
10:20:00.001229 IP 238.109.212.178.80 > 236.30.76.179.27540: tcp 1380
10:20:00.001242 IP 241.8.254.187.3505 > 4.85.183.55.1214: tcp 1460
10:20:00.001247 IP 3.3.241.156.8452 > 4.29.86.119.4376: tcp 1160
10:20:00.001251 IP 115.42.247.77.5275 > 225.113.36.69.80: tcp 0
10:20:00.001257 IP 225.211.255.204.65337 > 3.43.164.219.119: tcp 0
10:20:00.001277 IP 3.236.223.75.80 > 244.134.5.136.23812: tcp 1448
10:20:00.001283 IP 115.34.194.225.1103 > 69.102.85.13.3037: UDP, length 18
10:20:00.001284 IP 140.136.248.91.45818 > 3.82.176.112.21: tcp 0
10:20:00.001285 IP 140.112.32.213.39373 > 252.80.191.254.53: tcp 142
10:20:00.001286 IP 140.136.80.119.56237 > 3.82.176.112.21: tcp 0
10:20:00.001294 IP 3.223.149.20.80 > 225.212.155.180.62560: tcp 1196
10:20:00.001303 IP 162.131.189.129.8080 > 244.224.38.26.3364: tcp 1460
10:20:00.001308 IP 245.253.175.207.1869 > 225.113.7.113.10622: tcp 28
10:20:00.001312 IP 3.236.222.50.80 > 237.81.250.218.64991: tcp 436
10:20:00.001338 IP 241.110.64.60.8784 > 238.57.42.32.80: tcp 0
10:20:00.001342 IP 237.131.35.187.49348 > 249.136.204.122.80: tcp 0
10:20:00.001342 IP 241.8.247.75.1025 > 115.72.207.20.1214: tcp 1460
10:20:00.001347 IP 238.109.212.178.80 > 236.30.76.179.27540: tcp 1380
10:20:00.001352 IP 115.41.172.115.25399 > 239.187.118.128.80: tcp 0
10:20:00.001353 IP 115.41.172.115.25399 > 239.187.118.128.80: tcp 0
10:20:00.001379 IP 238.45.232.6.80 > 4.17.154.140.1428: tcp 1460
10:20:00.001404 IP 140.136.80.27.24035 > 3.82.176.112.21: tcp 0
10:20:00.001406 IP 140.136.248.125.22769 > 3.82.176.112.21: tcp 0
10:20:00.001406 IP 140.136.248.90.61291 > 3.82.176.112.21: tcp 0
10:20:00.001423 IP 238.109.212.178.80 > 3.185.24.2.4556: tcp 0
10:20:00.001424 IP 162.131.189.129.8080 > 244.224.38.26.3364: tcp 1460
10:20:00.001435 IP 115.43.212.72.6699 > 237.245.183.172.1187: tcp 0
10:20:00.001455 IP 115.35.101.156.6699 > 69.100.158.121.1055: tcp 1460
10:20:00.001461 IP 241.46.185.161.80 > 225.113.3.99.49702: tcp 1448
10:20:00.001465 IP 238.109.212.178.80 > 236.30.76.179.27540: tcp 1380
10:20:00.001470 IP 241.46.185.161.80 > 225.113.3.99.49702: tcp 327
10:20:00.001471 IP 143.69.167.150.4662 > 237.246.92.192.61916: tcp 1460
10:20:00.001477 IP 241.46.188.127.80 > 237.255.75.6.4697: tcp 255
10:20:00.001478 IP 241.46.218.115.80 > 245.216.27.198.3627: tcp 254
10:20:00.001480 IP 241.46.188.218.80 > 3.74.75.49.1049: tcp 1460
10:20:00.001485 IP 238.109.212.177.443 > 240.91.54.191.1706: tcp 0
10:20:00.001492 IP 0.3.117.73.80 > 160.45.50.67.52627: tcp 1448
10:20:00.001497 IP 3.3.236.253.80 > 4.44.6.42.4358: tcp 1460
10:20:00.001502 IP 107.213.234.191.3419 > 227.117.234.211.80: tcp 0
10:20:00.001502 IP 140.136.248.173.9374 > 3.82.176.112.21: tcp 0
10:20:00.001515 IP 162.131.189.129.80 > 69.4.145.139.4792: tcp 1460
10:20:00.001521 IP 0.3.117.70.80 > 247.41.86.254.65228: tcp 1408
10:20:00.001536 IP 3.236.223.75.80 > 244.134.5.136.23812: tcp 1448
10:20:00.001541 IP 0.3.117.73.80 > 160.45.50.67.52627: tcp 1448
10:20:00.001547 IP 3.3.240.115.7055 > 0.68.165.1.40400: tcp 0
10:20:00.001547 IP 227.64.161.155.80 > 237.83.213.217.2440: tcp 0
10:20:00.001564 IP 0.3.117.73.80 > 160.45.50.67.52627: tcp 1448
10:20:00.001569 IP 224.217.205.119.1709 > 238.57.194.56.80: tcp 308
10:20:00.001581 IP 162.142.157.250.1027 > 3.150.47.225.80: UDP, length 15
10:20:00.001583 IP 140.136.80.79.47474 > 3.82.176.112.21: tcp 0
10:20:00.001583 IP 140.136.172.52.3715 > 69.136.134.201.25: tcp 0
10:20:00.001584 IP 0.3.117.73.80 > 160.45.50.67.52627: tcp 1448
10:20:00.001589 IP 140.136.248.31.4520 > 3.82.176.112.21: tcp 0
10:20:00.001590 IP 140.136.248.217.8593 > 3.82.176.112.21: tcp 0
10:20:00.001593 IP 3.177.249.180.1161 > 239.187.83.137.80: tcp 267
10:20:00.001598 IP 238.109.212.178.80 > 236.30.76.179.27540: tcp 1380
10:20:00.001604 IP 162.131.189.129.8080 > 244.224.38.26.3364: tcp 1460
10:20:00.001632 IP 225.23.209.152.50468 > 3.43.183.140.80: tcp 14
10:20:00.001633 IP 227.64.161.155.80 > 237.83.213.217.2440: tcp 0
10:20:00.001637 IP 115.46.1.126.6699 > 237.71.206.231.61522: tcp 8
10:20:00.001638 IP 115.43.115.251.4667 > 69.102.0.250.1214: tcp 0
10:20:00.001657 IP 238.181.74.122.3544 > 3.43.164.219.119: tcp 0
10:20:00.001657 IP 143.69.190.10.1214 > 238.13.197.233.62983: tcp 0
10:20:00.001658 IP 227.33.176.151.25 > 237.57.60.7.26924: tcp 0
10:20:00.001666 IP 140.136.248.71.14498 > 3.82.176.112.21: tcp 0
10:20:00.001670 IP 140.136.248.180.28023 > 3.82.176.112.21: tcp 0
10:20:00.001673 IP 143.69.100.161.1214 > 4.87.88.19.3854: tcp 1296
10:20:00.001686 IP 107.215.15.46.3697 > 241.38.75.203.80: tcp 0
10:20:00.001702 IP 238.109.212.178.80 > 236.30.76.179.27540: tcp 1380
10:20:00.001721 IP 3.236.223.75.80 > 244.134.5.136.23812: tcp 1448
10:20:00.001727 IP 241.46.218.115.80 > 245.216.27.198.3627: tcp 0
10:20:00.001737 IP 107.212.15.246.2996 > 69.100.191.98.4662: tcp 0
10:20:00.001755 IP 236.33.145.240.2634 > 227.121.100.201.80: tcp 0
10:20:00.001758 IP 140.136.248.203.1136 > 3.82.176.112.21: tcp 0
10:20:00.001760 IP 162.131.189.129.80 > 87.226.70.178.4255: tcp 0
10:20:00.001769 IP 252.106.70.1.63328 > 0.2.74.221.80: tcp 861
10:20:00.001778 IP 69.247.2.137.2287 > 3.43.139.96.80: tcp 0
10:20:00.001781 IP 241.46.219.169.80 > 237.48.31.97.1247: tcp 156
10:20:00.001786 IP 241.46.185.227.80 > 236.227.183.230.13827: tcp 335
10:20:00.001788 IP 238.45.232.6.80 > 4.17.154.140.1428: tcp 1460
10:20:00.001793 IP 3.223.149.166.80 > 237.133.104.183.3557: tcp 1460
10:20:00.001798 IP 238.148.157.218.53 > 0.60.77.187.56878: UDP, length 125
10:20:00.001800 IP 143.182.24.84.1063 > 115.73.49.121.1412: tcp 324
10:20:00.001815 IP 238.110.16.208.80 > 4.97.78.50.48762: tcp 1460
10:20:00.001820 IP 238.109.212.178.80 > 236.30.76.179.27540: tcp 1380
10:20:00.001836 IP 140.136.248.84.56331 > 3.82.176.112.21: tcp 0
10:20:00.001839 IP 140.136.248.136.7078 > 3.82.176.112.21: tcp 0
10:20:00.001843 IP 3.236.221.166.80 > 255.208.29.101.13265: tcp 1448
10:20:00.001848 IP 115.54.182.255.4662 > 69.117.207.223.1210: tcp 761
10:20:00.001875 IP 140.136.248.167.40944 > 3.82.176.112.21: tcp 0
10:20:00.001882 IP 227.64.161.155.80 > 237.83.213.217.2440: tcp 0
10:20:00.001886 IP 3.236.215.191.80 > 70.23.13.6.1124: tcp 1460
10:20:00.001894 IP 241.188.36.48.80 > 3.74.244.247.1876: tcp 492
10:20:00.001896 IP 238.56.96.165.62772 > 4.20.25.27.1214: tcp 536
10:20:00.001900 IP 3.3.1.66.80 > 247.84.248.159.3551: tcp 1460
10:20:00.001905 IP 241.188.36.48.80 > 3.74.244.247.1876: tcp 0
10:20:00.001906 IP 238.203.169.99.80 > 115.72.201.252.4190: tcp 141
10:20:00.001909 IP 175.182.139.119.2784 > 238.109.233.231.80: tcp 0
10:20:00.001914 IP 140.136.80.153.45744 > 3.82.176.112.21: tcp 0
10:20:00.001923 IP 3.223.149.166.80 > 237.133.104.183.3557: tcp 1460
10:20:00.001935 IP 238.109.212.178.80 > 236.30.76.179.27540: tcp 1380
10:20:00.001940 IP 140.136.248.234.46916 > 3.82.176.112.21: tcp 0
10:20:00.001943 IP 140.136.248.39.11424 > 3.82.176.112.21: tcp 0
10:20:00.001948 IP 140.136.80.45.50989 > 3.82.176.112.21: tcp 0
10:20:00.001949 IP 3.236.221.166.80 > 255.208.29.101.13265: tcp 1448
10:20:00.001977 IP 140.136.248.219.7977 > 3.82.176.112.21: tcp 0
10:20:00.001981 IP 140.136.248.255.49879 > 3.82.176.112.21: tcp 0
10:20:00.001985 IP 3.236.223.25.80 > 245.146.80.1.1827: tcp 1460
10:20:00.001993 IP 3.193.127.51.3585 > 0.3.186.171.80: tcp 0
10:20:00.001996 IP 143.69.38.95.3527 > 239.187.74.53.80: tcp 287
10:20:00.001997 IP 107.213.255.165.1027 > 4.84.86.73.1214: tcp 0
10:20:00.001997 IP 238.2.87.195.1559 > 239.186.251.203.80: tcp 0
10:20:00.002001 IP 140.136.248.227.40177 > 3.82.176.112.21: tcp 0
10:20:00.002009 IP 161.187.11.224.80 > 69.102.234.224.3126: tcp 1414
10:20:00.002014 IP 3.236.215.191.80 > 70.23.13.6.1124: tcp 1460
10:20:00.002019 IP 115.35.194.69.2832 > 237.56.46.249.6699: tcp 1460
10:20:00.002024 IP 140.136.248.139.11243 > 3.82.176.112.21: tcp 0
10:20:00.002026 IP 243.160.204.44.25 > 69.10.242.48.33663: tcp 0
10:20:00.002027 IP 3.248.121.146.4448 > 0.113.209.39.6346: tcp 23
10:20:00.002030 IP 143.91.48.164.62282 > 238.57.134.200.80: tcp 325
10:20:00.002041 IP 227.186.164.224.80 > 69.117.107.72.1545: tcp 1460
10:20:00.002046 IP 238.255.74.5.80 > 4.19.43.110.4717: tcp 1427
10:20:00.002051 IP 238.109.212.180.80 > 2.230.35.219.1199: tcp 0
10:20:00.002051 IP 238.109.212.178.80 > 1.126.5.186.4087: tcp 12
10:20:00.002052 IP 238.109.212.180.80 > 2.230.35.219.1199: tcp 251
10:20:00.002053 IP 238.109.212.178.80 > 236.30.76.179.27540: tcp 1380
10:20:00.002062 IP 3.3.241.140.10062 > 171.234.217.88.3066: tcp 513
10:20:00.002064 IP 241.146.128.21.14928 > 244.225.93.221.80: tcp 0
10:20:00.002073 IP 3.236.221.166.80 > 255.208.29.101.13265: tcp 1448
10:20:00.002078 IP 238.109.212.178.80 > 1.126.5.186.4087: tcp 1380
10:20:00.002102 IP 143.69.169.27.2550 > 245.195.76.120.3076: tcp 0
10:20:00.002116 IP 238.109.212.178.80 > 3.185.24.2.4556: tcp 967
10:20:00.002119 IP 107.211.64.113.6699 > 115.73.95.208.4254: tcp 288
10:20:00.002140 IP 162.131.189.129.80 > 87.226.70.178.4245: tcp 228
10:20:00.002153 IP 227.64.161.155.80 > 237.83.213.217.2440: tcp 0
10:20:00.002154 IP 227.64.161.155.80 > 237.83.213.217.2440: tcp 0
10:20:00.002166 IP 3.3.241.140.10062 > 171.234.217.88.3066: tcp 1016
10:20:00.002171 IP 140.136.248.180.63552 > 3.82.176.112.21: tcp 0
10:20:00.002180 IP 227.212.176.40.1064 > 115.76.30.92.6699: tcp 307
10:20:00.002181 IP 162.131.209.252.23813 > 71.198.219.90.80: tcp 0
10:20:00.002184 IP 107.114.132.196.1459 > 227.231.56.62.80: tcp 4
10:20:00.002184 IP 224.83.80.75.1879 > 227.117.175.206.80: tcp 0
10:20:00.002190 IP 107.114.132.196.1459 > 227.231.56.62.80: tcp 536
10:20:00.002199 IP 224.86.8.136.1920 > 239.187.74.11.40516: tcp 0
10:20:00.002204 IP 238.109.212.163.61990 > 0.115.99.100.9898: tcp 0
10:20:00.002204 IP 140.136.80.77.14553 > 3.82.176.112.21: tcp 0
10:20:00.002205 IP 227.64.161.155.80 > 237.83.213.217.2440: tcp 0
10:20:00.002206 IP 3.236.215.191.80 > 70.23.13.6.1124: tcp 1460
10:20:00.002236 IP 238.109.212.180.80 > 71.246.62.105.4223: tcp 1380
10:20:00.002251 IP 238.109.212.178.80 > 236.30.76.179.27540: tcp 1380
10:20:00.002277 IP 3.223.149.166.80 > 69.232.200.157.1813: tcp 1332
10:20:00.002283 IP 0.3.117.181.80 > 225.71.203.133.1206: tcp 536
10:20:00.002285 IP 245.253.118.53.4416 > 115.76.153.62.1214: tcp 0
10:20:00.002285 IP 241.8.221.189.1214 > 69.92.8.218.1576: tcp 1460
10:20:00.002296 IP 1.78.194.81.80 > 236.13.35.171.33183: tcp 173
10:20:00.002297 IP 115.49.11.252.4662 > 237.44.169.101.3008: tcp 1460
10:20:00.002302 IP 143.182.27.147.3018 > 4.83.80.66.1214: tcp 1460
10:20:00.002307 IP 143.173.16.121.2344 > 115.75.152.221.1214: tcp 0
10:20:00.002317 IP 0.15.220.78.443 > 69.31.32.71.1431: tcp 533
10:20:00.002323 IP 3.176.108.26.1214 > 238.232.161.241.2140: tcp 1460
10:20:00.002328 IP 245.244.35.27.5005 > 236.171.226.39.20: tcp 0
10:20:00.002336 IP 3.236.215.224.1065 > 236.63.159.251.53: UDP, length 44
10:20:00.002348 IP 227.9.219.116.80 > 69.91.255.217.1610: tcp 1460
10:20:00.002353 IP 241.46.178.10.53 > 237.86.62.74.1028: UDP, length 98
10:20:00.002354 IP 0.3.117.181.80 > 225.71.203.133.1206: tcp 536
10:20:00.002356 IP 140.136.248.47.12329 > 3.82.176.112.21: tcp 0
10:20:00.002361 IP 140.136.248.247.35333 > 3.82.176.112.21: tcp 0
10:20:00.002368 IP 238.109.212.178.80 > 236.30.76.179.27540: tcp 1380
10:20:00.002373 IP 115.19.79.166.1171 > 0.3.164.70.80: tcp 0
10:20:00.002373 IP 107.215.251.33.6112 > 4.86.175.95.2312: tcp 12
10:20:00.002398 IP 3.223.149.166.80 > 69.232.200.157.1813: tcp 1332
10:20:00.002405 IP 227.64.161.155.80 > 237.83.213.217.2440: tcp 0
10:20:00.002406 IP 140.137.59.55.2550 > 237.87.2.250.4662: tcp 0
10:20:00.002418 IP 241.201.106.149.2829 > 71.199.64.153.22: tcp 0
10:20:00.002419 IP 115.254.249.219.1214 > 225.116.184.245.1156: tcp 1440
10:20:00.002424 IP 140.136.248.27.45358 > 3.82.176.112.21: tcp 0
10:20:00.002424 IP 140.136.80.52.17249 > 3.82.176.112.21: tcp 0
10:20:00.002424 IP 140.137.3.77.80 > 0.164.42.58.3414: tcp 0
10:20:00.002430 IP 140.136.248.58.15448 > 3.82.176.112.21: tcp 0
10:20:00.002437 IP 245.56.204.41.1485 > 69.154.211.103.21: tcp 0
10:20:00.002445 IP 252.208.127.246.32775 > 252.147.202.29.53: UDP, length 37
10:20:00.002458 IP 3.223.149.166.80 > 69.232.200.157.1813: tcp 961
10:20:00.002462 IP 157.142.180.174.3032 > 70.74.125.213.3320: UDP, length 26
10:20:00.002468 IP 238.109.212.178.80 > 238.62.72.145.1561: tcp 175
10:20:00.002481 IP 3.3.118.212.80 > 248.95.73.253.4565: tcp 1460
10:20:00.002486 IP 162.131.209.252.24552 > 238.154.82.5.80: tcp 0
10:20:00.002486 IP 238.109.212.178.80 > 236.30.76.179.27540: tcp 1380
10:20:00.002491 IP 0.3.117.70.80 > 242.67.47.8.44054: tcp 211
10:20:00.002492 IP 3.3.131.202.80 > 4.16.11.212.3433: tcp 567
10:20:00.002495 IP 140.136.248.253.60553 > 3.82.176.112.21: tcp 0
10:20:00.002500 IP 140.140.163.182.3894 > 244.27.172.27.21: tcp 0
10:20:00.002504 IP 107.210.175.75.1133 > 239.187.118.128.80: tcp 440
10:20:00.002506 IP 69.240.162.46.4810 > 238.57.194.56.80: tcp 0
10:20:00.002508 IP 227.64.161.155.80 > 237.83.213.217.2440: tcp 0
10:20:00.002508 IP 227.64.161.155.80 > 237.83.213.217.2440: tcp 0
10:20:00.002509 IP 241.46.236.195.80 > 237.55.189.110.1171: tcp 1414
10:20:00.002526 IP 0.61.219.228.39018 > 237.222.145.251.14344: UDP, length 36
10:20:00.002553 IP 3.176.5.42.1159 > 3.195.251.96.1716: UDP, length 34
10:20:00.002553 IP 162.131.129.245.1363 > 244.63.202.149.8080: tcp 0
10:20:00.002558 IP 162.131.254.73.1918 > 69.154.211.103.21: tcp 0
10:20:00.002563 IP 140.136.248.44.59962 > 3.82.176.112.21: tcp 0
10:20:00.002567 IP 241.46.219.169.80 > 237.254.98.36.1175: tcp 1460
10:20:00.002572 IP 238.109.212.178.80 > 71.225.122.96.26259: tcp 0
10:20:00.002582 IP 3.236.221.252.80 > 4.107.27.98.3218: tcp 1460
10:20:00.002600 IP 238.109.212.178.80 > 236.30.76.179.27540: tcp 1380
10:20:00.002605 IP 140.131.121.225.1619 > 237.126.211.171.80: tcp 0
10:20:00.002618 IP 115.43.249.228.1172 > 237.32.117.160.10007: tcp 0
10:20:00.002624 IP 0.71.112.218.23758 > 237.49.8.237.6699: tcp 1414
10:20:00.002629 IP 0.71.112.218.23758 > 237.49.8.237.6699: tcp 666
10:20:00.002631 IP 143.173.39.73.6112 > 237.55.57.69.6112: UDP, length 23
10:20:00.002632 IP 227.212.190.90.6699 > 236.143.15.39.4241: tcp 0
10:20:00.002635 IP 162.131.129.185.37914 > 0.33.177.200.80: tcp 0
10:20:00.002636 IP 162.131.189.129.80 > 87.226.70.178.4246: tcp 170
10:20:00.002642 IP 140.136.248.36.9585 > 3.82.176.112.21: tcp 0
10:20:00.002652 IP 241.46.236.195.80 > 237.55.189.110.1171: tcp 1414
10:20:00.002659 IP 0.3.117.70.80 > 242.67.47.8.44054: tcp 0
10:20:00.002669 IP 0.3.117.73.80 > 160.45.50.67.52627: tcp 1448
10:20:00.002674 IP 241.46.236.195.80 > 237.55.189.110.1171: tcp 1414
10:20:00.002679 IP 115.32.70.67.1729 > 237.32.117.167.10003: tcp 0
10:20:00.002679 IP 227.71.225.10.1556 > 227.231.67.5.53: UDP, length 32
10:20:00.002679 IP 225.23.217.179.62648 > 3.43.183.139.80: tcp 0
10:20:00.002686 IP 0.3.117.73.80 > 160.45.50.67.52627: tcp 48
10:20:00.002687 IP 140.136.80.21.11367 > 3.82.176.112.21: tcp 0
10:20:00.002697 IP 1.78.194.81.80 > 236.13.35.171.33183: tcp 222
10:20:00.002700 IP 0.3.117.70.80 > 155.83.123.129.36234: tcp 0
10:20:00.002712 IP 241.46.236.195.80 > 237.55.189.110.1171: tcp 1414
10:20:00.002718 IP 0.3.117.73.80 > 160.45.50.67.52627: tcp 1448
10:20:00.002723 IP 241.46.139.14.25 > 172.127.47.251.59145: tcp 27
10:20:00.002726 IP 3.236.221.252.80 > 4.107.27.98.3218: tcp 1460
10:20:00.002731 IP 238.109.212.178.80 > 236.30.76.179.27540: tcp 1380
10:20:00.002735 IP 241.46.236.195.80 > 237.55.189.110.1171: tcp 1414
10:20:00.002742 IP 0.3.117.73.80 > 160.45.50.67.52627: tcp 1448
10:20:00.002753 IP 245.56.204.41.1579 > 69.154.211.103.21: tcp 0
10:20:00.002764 IP 0.3.117.73.80 > 160.45.50.67.52627: tcp 1448
10:20:00.002771 IP 227.212.221.229.6347 > 115.74.67.122.50042: tcp 1024
10:20:00.002784 IP 241.46.219.169.80 > 237.254.98.36.1175: tcp 1460
10:20:00.002803 IP 107.215.175.13.6257 > 69.102.36.26.6257: UDP, length 102
10:20:00.002814 IP 241.46.218.114.80 > 236.13.35.173.49453: tcp 255
10:20:00.002815 IP 69.242.172.74.80 > 245.227.115.42.19484: tcp 1448
10:20:00.002820 IP 140.136.248.89.4679 > 3.82.176.112.21: tcp 0
10:20:00.002821 IP 241.46.218.115.80 > 69.103.63.105.2663: tcp 0
10:20:00.002821 IP 140.136.248.153.32854 > 3.82.176.112.21: tcp 0
10:20:00.002825 IP 140.136.61.250.110 > 238.50.154.46.1038: tcp 536
10:20:00.002827 IP 140.157.31.166.33032 > 227.209.188.153.80: tcp 308
10:20:00.002828 IP 140.136.248.241.38076 > 3.82.176.112.21: tcp 0
10:20:00.002829 IP 241.46.219.169.80 > 237.254.98.36.1175: tcp 1460
10:20:00.002834 IP 0.61.219.228.39040 > 237.222.145.251.14428: UDP, length 36
10:20:00.002834 IP 140.136.248.248.64492 > 3.82.176.112.21: tcp 0
10:20:00.002835 IP 107.213.137.200.1301 > 3.195.251.107.1716: UDP, length 22
10:20:00.002835 IP 249.165.171.230.4513 > 0.3.83.22.80: tcp 0
10:20:00.002843 IP 115.45.103.231.6699 > 237.86.254.59.1155: tcp 454
10:20:00.002847 IP 3.223.149.175.80 > 236.198.74.28.2133: tcp 1124
10:20:00.002851 IP 3.160.99.45.22259 > 0.2.74.230.80: tcp 0
10:20:00.002864 IP 0.3.117.181.80 > 236.34.41.114.25128: tcp 1380
10:20:00.002889 IP 238.109.212.178.80 > 236.30.76.179.27540: tcp 1380
10:20:00.002894 IP 238.45.232.6.80 > 4.96.125.250.1944: tcp 1460
10:20:00.002899 IP 245.252.215.141.1995 > 225.3.161.84.1214: tcp 536
10:20:00.002901 IP 0.3.117.37.80 > 155.83.54.79.24848: tcp 198
10:20:00.002902 IP 69.242.172.74.80 > 245.227.115.42.19484: tcp 1448
10:20:00.002907 IP 0.3.117.37.80 > 155.83.54.79.24848: tcp 0
10:20:00.002908 IP 241.46.139.14.25 > 237.62.110.92.4750: tcp 84
10:20:00.002909 IP 225.70.82.215.1546 > 159.154.169.148.5001: tcp 7
10:20:00.002924 IP 143.182.25.179.1214 > 4.83.218.68.4007: tcp 1460
10:20:00.002945 IP 143.182.243.238.6346 > 115.78.80.243.3128: tcp 23
10:20:00.002950 IP 0.3.117.185.22163 > 252.159.134.128.80: tcp 0
10:20:00.002955 IP 115.34.208.155.4137 > 237.84.66.143.1755: tcp 0
10:20:00.002955 IP 128.232.220.172.50583 > 238.223.139.50.80: tcp 0
10:20:00.002964 IP 143.69.164.182.1214 > 4.86.96.201.4149: tcp 1452
10:20:00.002971 IP 143.173.109.178.6699 > 237.5.46.160.16123: tcp 370
10:20:00.002983 IP 161.187.11.224.80 > 69.102.234.224.3126: tcp 1414
10:20:00.002990 IP 0.3.117.180.80 > 225.243.248.59.3560: tcp 1460
10:20:00.003004 IP 225.211.250.91.63329 > 3.43.139.181.80: tcp 0
10:20:00.003007 IP 238.109.212.178.80 > 236.30.76.179.27540: tcp 1380
10:20:00.003012 IP 3.176.78.117.4583 > 4.85.92.227.6346: tcp 524
10:20:00.003017 IP 115.51.48.220.1463 > 237.173.182.45.6699: tcp 1448
10:20:00.003022 IP 69.242.172.74.80 > 245.227.115.42.19484: tcp 1448
10:20:00.003030 IP 238.74.240.230.2235 > 115.78.84.110.1214: tcp 0
10:20:00.003038 IP 243.21.57.27.6346 > 115.77.54.145.2008: tcp 1460
10:20:00.003045 IP 238.45.232.6.80 > 4.96.125.250.1944: tcp 1460
10:20:00.003050 IP 236.33.9.220.3884 > 69.182.248.80.4662: tcp 0
10:20:00.003050 IP 140.136.80.42.56508 > 3.82.176.112.21: tcp 0
10:20:00.003058 IP 236.207.239.6.80 > 225.243.235.35.62130: tcp 1460
10:20:00.003063 IP 227.64.161.155.80 > 225.22.61.232.4936: tcp 0
10:20:00.003069 IP 107.211.65.62.2922 > 3.195.251.86.1716: UDP, length 30
10:20:00.003096 IP 140.136.248.79.37909 > 3.82.176.112.21: tcp 0
10:20:00.003101 IP 107.215.61.253.6346 > 4.85.77.191.3245: tcp 0
10:20:00.003104 IP 241.46.188.127.80 > 237.255.75.6.4697: tcp 258
10:20:00.003114 IP 0.3.117.185.22163 > 252.159.134.128.80: tcp 0
10:20:00.003122 IP 0.3.117.180.80 > 225.243.248.59.3560: tcp 1460
10:20:00.003127 IP 140.136.249.7.38449 > 3.82.176.112.21: tcp 0
10:20:00.003153 IP 69.242.172.74.80 > 245.227.115.42.19484: tcp 1448
10:20:00.003159 IP 140.136.248.31.54671 > 3.82.176.112.21: tcp 0
10:20:00.003159 IP 140.136.248.104.61713 > 3.82.176.112.21: tcp 0
10:20:00.003159 IP 245.55.244.77.2612 > 69.157.18.29.80: tcp 0
10:20:00.003171 IP 115.40.29.62.6699 > 237.55.139.161.4677: tcp 1460
10:20:00.003176 IP 249.165.171.230.4513 > 0.3.83.22.80: tcp 0
10:20:00.003180 IP 1.78.205.1.80 > 236.230.114.85.1112: tcp 334
10:20:00.003182 IP 140.136.248.233.10133 > 3.82.176.112.21: tcp 0
10:20:00.003188 IP 162.131.199.254.24537 > 0.115.99.3.80: tcp 0
10:20:00.003198 IP 3.236.223.69.80 > 171.232.74.133.1142: tcp 1322
10:20:00.003219 IP 227.212.104.218.80 > 237.5.46.158.57979: tcp 1460
10:20:00.003235 IP 227.139.62.47.80 > 115.155.164.26.2992: tcp 1436
10:20:00.003240 IP 238.109.212.178.80 > 227.181.244.110.1303: tcp 0
10:20:00.003251 IP 225.209.100.176.2679 > 3.43.183.141.80: tcp 0
10:20:00.003263 IP 238.109.212.178.80 > 227.181.244.110.1303: tcp 175
10:20:00.003270 IP 115.41.3.85.1057 > 69.98.35.205.6699: tcp 368
10:20:00.003277 IP 3.236.215.214.80 > 4.18.7.82.1397: tcp 1460
10:20:00.003283 IP 241.46.188.127.80 > 237.83.213.213.55408: tcp 258
10:20:00.003284 IP 238.109.212.178.80 > 71.225.122.96.26259: tcp 175
10:20:00.003287 IP 0.15.118.85.3441 > 4.87.191.229.4143: tcp 0
10:20:00.003298 IP 143.173.104.157.1214 > 4.82.45.44.2623: tcp 1460
10:20:00.003319 IP 238.109.212.178.80 > 236.30.76.179.27540: tcp 1380
10:20:00.003324 IP 240.34.190.141.1145 > 227.231.47.87.80: tcp 0
10:20:00.003340 IP 227.212.216.65.2350 > 69.31.99.197.2350: UDP, length 16
10:20:00.003342 IP 227.78.206.114.3266 > 69.97.223.42.80: tcp 0
10:20:00.003348 IP 227.144.234.34.80 > 4.100.32.174.1593: tcp 1460
10:20:00.003354 IP 140.136.248.113.59188 > 3.82.176.112.21: tcp 0
10:20:00.003364 IP 3.236.223.69.80 > 171.232.74.133.1142: tcp 1322
10:20:00.003369 IP 162.140.206.106.1488 > 232.29.218.185.80: tcp 0
10:20:00.003370 IP 140.136.248.67.34993 > 3.82.176.112.21: tcp 0
10:20:00.003384 IP 227.64.161.155.80 > 237.83.213.217.2440: tcp 0
10:20:00.003384 IP 227.64.161.155.80 > 237.83.213.217.2440: tcp 0
10:20:00.003386 IP 115.52.123.236.1182 > 237.32.117.160.10007: tcp 0